video_id,question_id,question_type,timestamp (s),question,correct_answer
5008,13.0,location,8.8,where can i find more information about peak event services?,peakeventservices.com
5014,4.0,location,3.8,where is the warby parker store located on this street?,on the right side of the street
5014,7.0,location,5.5,where can i find the entrance to icon theatres in this area?,near the building with the icon theatres sign on the right-hand side
5014,11.0,location,7.2,what is the building right next to the icon theatre sign?,echelon
5017,3.0,location,3.8,which hotel appears to be nearby in case i need accommodation?,wyndham
5017,6.0,location,2.2,which store has a special on t-shirts for $0.99?,unique boutique
5017,7.0,location,5.5,where can i get a smoothie around here?,smoothie king
5017,10.0,location,7.2,which restaurant should i go to for a quick bite involving sandwiches?,subway
5017,12.0,location,8.8,which place should i head to if i'm craving a burger?,mcdonald's
5017,14.0,location,8.8,where is the subway located in relation to mcdonald's?,"subway is on the left side of the street, while mcdonald's is on the right"
5019,9.0,location,7.2,where can i find a place to eat nearby?,mcdonald's
5019,13.0,location,8.8,what is the market on this street?,royal street market
5019,14.0,location,8.8,which hotel can i find on this street?,wyndham
5019,15.0,location,4.2,where can i cash a check?,capital one bank
5020,6.0,location,5.5,which building in the vicinity has a hotel?,the building with astor on it
5020,9.0,location,3.2,where can i find an atm?,"across the street from mr. b's bistro, to my right"
5020,10.0,location,7.2,what store do i see on the left side of the street as i am approaching the stop sign?,walgreens
5021,3.0,location,3.8,where can i park to visit the steak and lobster restaurant?,there is no the steak and lobster restaurant here
5021,9.0,location,7.2,where can i perform my bank transactions?,regions
5021,12.0,location,8.8,where is the parking entrance located?,next to intercontinental hotel
5027,14.0,location,8.8,where can i find the valet service for my car?,at the small pedestal sign next ‘valet’ to the driveway on the right
5030,3.0,location,3.8,"can you tell me if there's a parking garage around here and, if so, where it is located?","no, but you can park on the left side across the road"
5030,8.0,location,5.5,which hospital is near my current location?,hahnemann university hospital
5031,1.0,location,2.2,where exactly is hahnemann university hospital advertised?,on a mural on the left side
5035,2.0,location,2.2,which gas station is on the right side of this road?,chevron
5035,9.0,location,7.2,where can i go to find a place named patrick's roadhouse?,next to the chevron gas station
5035,14.1,location,8.8,which place offers craft beers and fine wines?,state beach liquor
5035,14.2,location,1.2,which place offers craft beers and fine wines?,there is no corresponding place here
5076,12.0,location,8.8,which company's building is visible?,r. d. olson
5076,14.0,location,8.8,can i find a place to grab some donuts nearby?,"yes, there is a dunkin' donuts"
5077,3.0,location,3.8,which street intersection am i at?,olympic blvd
5077,7.0,location,5.5,which street am i currently on?,olympic bl
5077,8.0,location,5.5,what establishment is now open?,hanover olympic
5078,1.0,location,2.2,where can i find the beauty supply store?,on the right side of the street with a pink sign
5078,11.0,location,7.2,"which store offers bath, kitchen, and lighting products?",ferguson
5078,13.0,location,8.8,where is the beauty supply store located?,121 chamber st
5078,15.0,location,7.8,which supply store offers wholesale options on chamber street?,beauty supply
5083,15.0,location,7.8,"is there a bike lane nearby, and where should i look for it?","yes, on the right side"
5094,5.0,location,3.8,where can i find a newly opened store nearby?,now open (sign on the building next to the green van)
5100,6.0,location,5.5,which street am i currently on in this busy city area?,chambers st
5100,13.0,location,8.8,where can i get pizza delivered for free?,dona bella pizza
5100,14.0,location,8.8,what is the company that handles commercial refrigeration in this area?,air depot commercial refrigeration corp
5100,15.0,location,7.8,which street am i on right now?,church street
5101,3.0,location,3.8,where can i find a place to get a coffee nearby?,at the starbucks on the left
5101,6.0,location,5.5,where do i go to get assistance from the police?,acs police
5101,7.0,location,5.5,where can i find a place to grab some pizza around here?,pronto pizza at 141 fulton st
5102,1.0,location,2.2,what's the name of the bike-sharing program available on this street?,citibike
5102,3.0,location,3.8,where can i buy fresh juice?,magic mix juicery
5102,5.0,location,3.8,which store should i go to for buying a cell phone?,verizon store on the left
5102,6.0,location,5.5,what dining options are available on this street?,burgerking
5102,8.0,location,5.5,which building offers no fee for newly renovated apartments?,106 fulton street
5102,14.0,location,8.8,which establishment offers healthy food options around here?,hale & hearty
5102,15.0,location,7.8,where can i go to find yoga classes nearby?,yogacare.com
5116,10.1,location,7.2,where can i find a pharmacy?,botica del pueblo
5116,10.2,location,1.2,where can i find a pharmacy?,there is no pharmacy around here here
5142,5.0,location,3.8,where can i get a coffee from around here?,brighton coffee shop
5142,6.0,location,5.5,what is the shop next to vhernier?,teuscher
5143,8.0,location,5.5,which building has a deli inside?,the building on the left
5143,12.0,location,8.8,where is the bakery?,at the location marked bakery on the left
5143,15.0,location,7.8,what street am i currently on?,bedford drive
5147,6.0,location,5.5,which tour bus company should i contact to learn more about the available tours?,starline tours
5147,10.0,location,7.2,where is the post office?,it's located on the right side of the street
5156,1.0,location,2.2,where can i find a place to cash my checks around here?,checks cashed on the right side
5156,7.0,location,5.5,where is the los angeles sign located in relation to the street?,the los angeles sign is on the right side of the street
5157,1.0,location,2.2,what is the building where i can find multiple jewelers?,wholesale jewelry mart
5157,2.1,location,2.2,where is the nearest public parking?,public parking on the left side
5157,2.2,location,9.8,where is the nearest public parking?,public parking on the right side
5157,8.0,location,5.5,which building houses the wholesale jewelers exchange?,637-639
5157,10.0,location,7.2,which jewelry store is located next to the parking garage?,wholesale jewelry mart
5159,4.0,location,3.8,where can i find the car wash near this location?,the car wash is on the left
5160,1.0,location,2.2,where can i find the high class jewel store?,on the left side of the street
5160,4.0,location,3.8,where can i go to cash a check?,checks cashed on the right side
5160,15.0,location,7.8,what is the theater located downtown?,palace
5161,2.0,location,2.2,where can i find a parcel delivery service nearby?,fedex
5161,8.0,location,5.5,which public transport service should i use to get to the downtown area?,metro silver line
5161,13.0,location,8.8,what is the recommended car wash service in this area?,carwash
5163,2.0,location,2.2,which hotel can i rent at nearby?,miyako hotel
5166,4.0,location,3.8,where is mr. masala indian cuisine located?,on the left side of the street next to the crosswalk
5166,13.0,location,8.8,where can i find valet parking along this street?,on the left
5167,3.0,location,3.8,where is the palace theater located in relation to 6th street?,it's right on 6th street
5169,1.0,location,2.2,what is the restaurant where i should go to get some authentic chinese cuisine on this street?,yang chow restaurant
5169,2.0,location,2.2,which plaza am i currently approaching?,chinatown plaza
5169,3.0,location,3.8,where could i park my car to visit multiple shops in this area?,in front of chinatown plaza
5169,7.0,location,5.5,where can i find wing wa hing gifts & arts?,on the right side of the street
5169,9.0,location,7.2,which bakery can i see along this street?,queen's bakery
5174,1.0,location,2.2,where can i find the billboard advertising the most popular vehicles in socal?,on a building to the left side of the road
5174,11.0,location,7.2,where can i find a car wash service around here?,it is located near the building with the large blue character
5174,13.0,location,8.8,what museum is located to the left as i continue driving down this street?,grammy museum
5177,4.0,location,3.8,where do i need to go to find a bridal shop?,teresa's bridals
5177,8.0,location,5.5,which jewelry store on the left should i check out on broadway?,golden rose jewelry
5177,11.0,location,7.2,which street am i currently on?,broadway
5177,15.0,location,7.8,which building should i enter to visit a jewelry mart?,broadway jewelry mart
5183,9.0,location,7.2,where is the daimaru motel located ?,on the right side of the street
5184,6.0,location,5.5,where can i find the yorkshire apartments from here?,on the left side of the street
5184,12.0,location,8.8,which building offers apartments for rent in this area?,look for the yorkshire apartments sign
5184,13.0,location,8.8,where can i find the nearest parking spot?,the nearest parking spot is indicated by the parking sign on the left side of the street
3,9.0,intention reasoning,8.5,where can i buy electrical and electronic products nearby?,p.c. richard & son
3,14.0,intention reasoning,10.5,"if i want to get to a famous event center from here, what is the nearest landmark?",barclays center
10,4.2,intention reasoning,1.1,what should i do to ensure i'm following the road markings in this area?,there are no road signs here
10,4.3,intention reasoning,5.0,what should i do to ensure i'm following the road markings in this area?,"pay attention to “ped xing” road markings, slow down and watch out for pedestrians"
11,12.0,intention reasoning,10.5,what types of fuel are available at gas stations?,diesel
11,15.1,intention reasoning,9.5,"if i need to make a stop for both a car wash and a snack, can i find both services nearby?",yes
11,15.2,intention reasoning,2.5,"if i need to make a stop for both a car wash and a snack, can i find both services nearby?",no
13,1.0,intention reasoning,2.5,what precautions should i take when navigating through this area?,slow down and be prepared for sudden stops or changes in traffic patterns
13,7.1,intention reasoning,6.3,where should i slow down carefully,near the intersection
13,7.2,intention reasoning,3.8,where should i slow down carefully,near the keep clean road markings
26,1.0,intention reasoning,2.2,what should i pay attention to when driving ahead?,"road work ahead, which may cause delays or lane closures"
34,11.0,intention reasoning,7.2,which company should i contact if i need welding or boiler work?,"hercules welding & boiler works, inc"
38,8.0,intention reasoning,6.5,how can i find a parking space?,follow the street signs indicating parking regulations
38,9.1,intention reasoning,8.5,which shops can i visit for lunch or dinner?,go to the bar & kitchen along the street
38,9.2,intention reasoning,10.2,which shops can i visit for lunch or dinner?,go to mee across the street
38,12.0,intention reasoning,10.5,how can i contact the postal service?,visit www.usps.com
44,3.0,intention reasoning,4.5,where should i go to buy electronics?,radioshack
100,1.0,intention reasoning,2.5,where should i stop my car?,near the area marked by the stop sign held by the traffic officer
100,3.0,intention reasoning,4.5,what should i do according to the traffic officer's instructions?,come to a complete stop as directed by the traffic officer
104,2.0,intention reasoning,2.2,how much does it cost to recharge air conditioning?,99
104,6.0,intention reasoning,5.5,which auto repair service should i contact for brake repairs?,prospect auto repair
111,1.0,intention reasoning,2.2,what should i be cautious of as i proceed down this street?,a school zone ahead with possible children crossing
111,10.0,intention reasoning,7.2,what kind of food is around here?,chicken
116,3.0,intention reasoning,3.8,where can i park if i want to visit pick-a-bagel?,"on the right side of the street, near the store"
116,4.0,intention reasoning,3.8,why should i slow down?,school zoom
116,11.0,intention reasoning,7.2,which phone number can i call to inquire about retail space for lease?,212.792.2600
119,1.0,intention reasoning,2.2,what number should i call to find out about moving services on this truck?,053-4206492
119,10.0,intention reasoning,7.2,what number should i call to contact the service of the isuzu truck in front of me?,1-800-566-777
122,4.0,intention reasoning,3.8,where can i download the app for flycleaners?,app store and google play
136,3.0,intention reasoning,3.8,can i drive faster than 45 miles per hour in this area?,"no, you cannot drive faster than 45 miles per hour"
143,2.0,intention reasoning,2.2,which direction should i follow?,follow the signs to long term parking
143,7.0,intention reasoning,5.5,what should i do when i approach the intersection ahead?,turn without stopping
144,5.0,intention reasoning,3.8,what bank should i deposit my money in?,garden state community bank
161,1.0,intention reasoning,2.2,which truck should i be following based on the license plate?,ag-51813
164,1.1,intention reasoning,2.2,what should i pay attention to when driving on this street,no turns are allowed
164,1.2,intention reasoning,9.5,what should i pay attention to when driving on this street,go straight only
169,8.0,intention reasoning,5.5,what is the website of the company i want to visit in front of me?,www.baldorfood.com
170,3.0,intention reasoning,3.8,which bank should i go to?,citi bank
170,5.0,intention reasoning,3.8,what cautionary sign should i be aware of?,don't block the box sign
170,6.0,intention reasoning,5.5,how fast am i allowed to drive in this area?,25 mph
170,11.0,intention reasoning,7.2,where is the nearest place i park?,at the intersection
179,1.0,intention reasoning,2.2,what is the address of the truck rental company's website?,gopenske.com
179,2.0,intention reasoning,2.2,how do i contact this truck rental company？,visit gopenske.com
179,6.0,intention reasoning,5.5,what service does penske truck rental provide for different types of moves?,household & business rentals
184,3.0,intention reasoning,3.8,which website can i visit to get more details about the bus service?,gobuses.com
184,6.0,intention reasoning,5.5,what is the telephone number i should call for go buses inquiries?,1-855-888-7160
211,4.1,intention reasoning,3.8,what is the maximum speed i can drive on this road?,the maximum speed is 40 mph
211,4.2,intention reasoning,1.3,what is the maximum speed i can drive on this road?,there are no speed limit signs here
211,9.0,intention reasoning,7.2,what speed should i maintain based on the sign and traffic flow?,lower than 40
232,12.1,intention reasoning,8.8,what should i pay attention to at this intersection?,you cannot turn right
232,12.2,intention reasoning,1.2,what should i pay attention to at this intersection?,go straight along the driveway
234,6.0,intention reasoning,5.5,which store should i go to to buy some home improvement items?,bob's discount furniture
234,8.1,intention reasoning,5.5,is there any upcoming road construction?,"yes, there is a sign that says road work 1/2 mile"
234,8.2,intention reasoning,1.1,is there any upcoming road construction?,no
235,4.0,intention reasoning,3.8,what phone service offers unlimited calling and voice mail to email?,phonesysteminc
235,5.0,intention reasoning,3.8,where can i call to inquire about relocating my phone service?,718-ip-phone
235,6.0,intention reasoning,5.5,how can i transfer calls to my cellphone?,call 718-477-4663
235,7.0,intention reasoning,5.5,what services does the company offer that can help me with moving my office phone system to a new location?,relocation
235,11.0,intention reasoning,7.2,which services does ip phone system inc. offer that can help me manage my business calls more efficiently?,transfer calls to cellphones
255,6.0,intention reasoning,5.5,can i drive at 30 mph on this road or do i need to slow down?,"no, you need to slow down"
287,2.0,intention reasoning,2.2,where can i find more information about the services offered by ccm?,ccminc.co
287,3.0,intention reasoning,3.8,what does the front car relate to?,general contractor
301,1.0,intention reasoning,2.2,where do i need to stop to keep the intersection clear?,near the keep intersection clear sign
310,5.0,intention reasoning,3.8,what's the message on the big orange sign?,instructions or information about the upcoming construction zone
313,2.0,intention reasoning,2.2,which bus should i take to get to the city center from the airport?,take the green bus labeled nyc airporter.
313,4.0,intention reasoning,3.8,where should i yield to pedestrians?,at the marked crosswalks
313,6.0,intention reasoning,5.5,what should i be aware of while driving near the delta terminal?,road work ahead
313,8.1,intention reasoning,5.5,am i allowed to pick someone up from these area?,no
313,8.2,intention reasoning,1.2,am i allowed to pick someone up from these area?,yes
313,12.1,intention reasoning,8.8,how do i get to departures and arrivals?,"departures turn right, arrivals turn left"
313,12.2,intention reasoning,1.9,how do i get to departures and arrivals?,there are no road signs here
313,14.0,intention reasoning,8.8,where should i stop if the traffic light is red?,at the stop here on red sign
318,1.0,intention reasoning,2.2,where should i stop if the traffic light turns red?,at the sign that says stop here on red signal
318,15.0,intention reasoning,7.8,is there a sign nearby indicating how long i have to wait until the green light turns green?,no visible signs indicating the wait time for the next green light
319,6.0,intention reasoning,5.5,where can i use cash to proceed?,cash lane only
333,4.0,intention reasoning,3.8,where can i rent a van for $19.95?,u-haul
333,6.0,intention reasoning,5.5,which cab service is available here?,martins
334,10.0,intention reasoning,7.2,what phone number should i call to book a ride with martins taxi service?,541-1234
337,5.0,intention reasoning,3.8,"where can i find the contact information for eurama food, inc.?",on the side of their truck
349,8.0,intention reasoning,5.5,which company offers white glove service for furniture transportation and delivery?,metropolitan warehouse & delivery
349,10.0,intention reasoning,7.2,what's the contact information for the metropolitan warehouse & delivery service?,800.300.7417
350,1.0,intention reasoning,2.2,which areas should i be extra cautious while driving?,areas where school is painted on the road
358,7.1,intention reasoning,5.5,what speed should i be maintaining while driving here?,you should be driving at or below 25 mph
358,7.2,intention reasoning,2.3,what speed should i be maintaining while driving here?,there are no speed limit signs here
358,8.0,intention reasoning,5.5,where should i avoid storing some of my belongings?,you should avoid using self-storage
361,9.0,intention reasoning,7.2,which direction is safest for pedestrians crossing the street right now?,cross in front of the duane reade store
366,11.0,intention reasoning,7.2,what shopping carts are available?,near the right side in the parking lot
381,1.0,intention reasoning,2.2,where do i call for information on hiring a driver?,1-877-337-2017
381,2.0,intention reasoning,2.2,which number should i note if i need to reference the specific access-a-ride service i am following?,4217mvt
384,13.0,intention reasoning,8.8,where should i stop if i encounter a red signal?,stop here on red signal
386,6.0,intention reasoning,5.5,how can i confirm the name or contact details of the company whose truck is blocking my view?,read the back of the truck for the company name and contact details
386,7.0,intention reasoning,5.5,what type of goods is the truck in front of me carrying?,bread
390,1.0,intention reasoning,2.2,what's speed should i keep while exiting?,15 mph
391,3.0,intention reasoning,3.8,what should i be aware of when continuing straight on this street?,the stop sign ahead
392,3.1,intention reasoning,3.8,can i park the car on eldert st.?,no
392,3.2,intention reasoning,1.3,can i park the car on eldert st.?,yes
392,6.0,intention reasoning,5.5,where can i park?,park along the street sides after the stop sign
411,1.0,intention reasoning,2.2,which bus goes to the airport?,32
411,5.0,intention reasoning,3.8,where can i find more information about the airport parking services?,www.parksfo.com
411,6.0,intention reasoning,5.5,what is the phone number i can call to inquire about parking availability?,866-727-5736
414,3.0,intention reasoning,3.8,how can i identify the vehicle directly in front of me by its license plate?,hkz-3544
417,5.0,intention reasoning,3.8,who should i contact for medical care and how to contact?,"westchester medical health care, (347) 851-6633"
417,7.0,intention reasoning,5.5,what number can i call to get information about their services?,888-976-5155
417,14.0,intention reasoning,8.8,which company should i contact to deliver things elsewhere?,furniture direct 888-976-5155
418,1.0,intention reasoning,2.2,what kind of services might i find at h&r block?,tax assistance
418,3.0,intention reasoning,3.8,where can i inquire about furniture delivery options?,inquire at furniture direct for furniture delivery options
418,4.0,intention reasoning,3.8,which store should i go to buy some vitamins and supplements?,gnc
419,6.0,intention reasoning,5.5,which building should i head towards to do some banking?,bank of america
419,12.0,intention reasoning,8.8,what should i pay attention to when parking here?,no standing anytime
434,11.0,intention reasoning,7.2,which organization might be appropriate to contact to donate a car?,kars 4 kids
446,7.1,intention reasoning,5.5,which lane should i be in if i'm driving slower than the traffic?,keep right
446,7.2,intention reasoning,2.5,which lane should i be in if i'm driving slower than the traffic?,there are no explicitly instructions
446,11.0,intention reasoning,7.2,what should be cautious of in this area?,gusty wind area next 5 miles
454,6.0,intention reasoning,5.5,how can i contact moose pro painting?,call 415 596-5108 or email moosepro911@gmail.com
474,5.0,intention reasoning,3.8,which department should i contact for law enforcement assistance?,metropolitan transportation authority
502,9.0,intention reasoning,7.2,what phone number should i call to get more information about the services at 10 times square?,212.812.5908
503,6.0,intention reasoning,5.5,where can i stop if i need information or assistance on this route?,at the plattekill service area
509,2.0,intention reasoning,2.2,what should i be cautious of when driving through this area?,children crossing the road due to the nearby school
516,9.0,intention reasoning,7.2,which delivery service could i use based on what i see around me?,fedex
2020,4.0,intention reasoning,4.5,"which bike has the license plate ts 07 ex 6124, and who is riding it in front of me?",the bike on the left with a rider wearing a black backpack
2021,14.0,intention reasoning,10.5,can you tell me if the ghmc barricades are blocking a specific lane or just marking a boundary?,they are just marking a boundary
2022,7.0,intention reasoning,6.5,what safety advice is given to motorcyclists by the gachibowli traffic police station?,wear helmet ride safely
2022,12.0,intention reasoning,10.5,which driving advice is suggested for safer travel?,"leave sooner, drive slower, live longer"
2022,15.0,intention reasoning,9.5,which message should i follow to ensure i've fastened my seatbelt?,seat belts save lives
2023,1.0,intention reasoning,2.5,what should i not do according to the traffic sign?,do not drink and drive
2026,2.0,intention reasoning,2.5,what's the make of the car in front?,ford figo
2026,13.1,intention reasoning,10.2,how do i contact roadside advertisers?,7702 87 87 87
2026,13.2,intention reasoning,1.5,how do i contact roadside advertisers?,there are no advertisements around here
2026,15.0,intention reasoning,9.2,where should i look to find the contact information while waiting at the traffic light?,on the right side of the intersection
2041,1.0,intention reasoning,2.5,which app should i use for local courier services?,brings local delivery app
2042,1.0,intention reasoning,2.5,what company offers local courier services?,brings local courier service
2042,2.0,intention reasoning,2.5,where can i find more information about the local courier service?,www.brings.app
2042,8.0,intention reasoning,6.5,what advertisements can i see on the bus?,baked goods like bread and other bakery items
2100,1.0,intention reasoning,2.2,at what speed am i supposed to drive on this road?,40
2103,9.0,intention reasoning,7.2,where should i go to buy and rent flats?,diamond oak
2103,15.0,intention reasoning,7.8,what safety measure should i take while driving through this area?,"school zone, go slow and pedestrian crossing"
2128,9.0,intention reasoning,7.2,how does the advertisement on the auto-rickshaw encourage environmental conservation?,by promoting the use of vboard with the message savetrees - use vboard
2247,6.0,intention reasoning,5.5,do any of the shops around here provide medical services in addition to the hospital?,"no, only shree hospital provides medical services"
2250,13.1,intention reasoning,8.8,which place should i go to if i want to eat and drink?,restaurant & bar
2250,13.2,intention reasoning,3.4,which place should i go to if i want to eat and drink?,not found
2250,14.0,intention reasoning,8.8,where can i find information about purchasing villas?,la paloma villas at nidmala
2341,1.0,intention reasoning,2.2,what is the speed limit that i should adhere to on this road?,30
