video_id,question_id,question_type,timestamp (s),question,correct_answer
4680,1.0,description,2.2,what are the names of the businesses on my left and right as i drive along this street?,spacenk and rush
4680,6.0,description,5.5,what's the license plate of the white van?,kp67 nvc
4680,12.0,description,8.8,what slogan is displayed on the 'relay' truck?,your equipment secure in safe hands
4684,7.0,description,5.5,what are the names of the two clothing stores i can visit on this street?,miss london and zara
4684,9.0,description,7.2,which cars' license plates are visible in front of me as i drive down this road?,m200 mmb and en09 nty
4689,6.0,description,5.5,which relocation company that the red truck belongs to?,crown relocations
4689,12.0,description,8.8,which of the vehicles ahead has the license plate ma66 ngz?,the white van
4692,4.0,description,3.8,what's the number of the bus route?,28
4692,9.0,description,7.2,"is the bective property available to rent, or has it already been let?",the bective property is available to rent as indicated by the to let sign
4692,10.0,description,7.2,which leasing company that has the property to let?,bective
4695,5.0,description,3.8,what is the destination mentioned on the front of the double-decker bus?,chiswick business park
4695,15.0,description,7.8,which trucks are blocking the road?,iveco
4698,6.0,description,5.5,is the parking area designated for general parking or for a specific purpose?,it is a bus stop zone
4699,3.0,description,3.8,what is the route number for the red double-decker bus?,28 on the red bus
4700,12.0,description,8.8,what's the complete license plate of the car right in front of me?,st10 xcy
4703,12.0,description,8.8,could you tell me one of the license plates in front of us?,gc14 dxa
4704,8.0,description,5.5,which car is right in front of me?,st10 xcy
4708,1.0,description,2.2,what is the contact number for flower delivery?,0800 781 8877
4708,2.0,description,2.2,which company's website is in front of me?,flowers24hours.co.uk
4708,6.0,description,5.5,what are the delivery stipulations for flowers ordered on the van?,london delivery today. rest of uk next day!
4711,1.0,description,2.2,what is the phone number for ordering flowers?,0800 781 8877
4711,4.0,description,3.8,"which company's van is in front of me, and what service do they provide?","flowers 24 hours, flower delivery service"
4711,12.0,description,8.8,what type of truck (by company name) is ahead of the flowers 24hours.co.uk vehicle?,waitrose truck
4714,2.0,description,2.2,what does the sign say on the construction vehicle near the statue?,bikers take extra care passing this vehicle
4714,3.0,description,3.8,which vehicle in front of me has the registration number yf13 hvd?,the mercedes
4714,8.0,description,5.5,what type of vehicle is indicated to have special environmental features here?,bluetec hybrid
4714,10.0,description,7.2,what company is operating the truck passing in front of me?,keltbray
4715,13.0,description,8.8,what service does the company on the left truck offer?,technology for business
4721,6.0,description,5.5,what company name appears on the green truck passing by?,waitrose
4721,9.0,description,7.2,what company is responsible for the white van parked next to the white building?,truline
4721,13.0,description,8.8,does the company behind the van deliver flowers only in london or also in other parts of the uk?,"london delivery today. rest of uk, next day!"
4722,9.0,description,7.2,which company does the black car ahead belong to?,addison lee
4722,13.0,description,8.8,which company does the van in front of me belong to?,mote electrical
4722,15.0,description,7.8,which street is on the left?,park place sw1
4724,10.0,description,7.2,what types of food does itsu offer based on the storefront?,"sushi, rice bowls, soups, hot noodles"
4724,11.0,description,7.2,which bus advertises a dairy-free product that promises no 'funny bus-ness'?,a colorful double-decker bus
4726,6.0,description,5.5,what delivery service is being used by the white van ahead?,sainsbury's
4732,1.0,description,2.2,which delivery company that offers nationwide express services?,melia line ltd
4732,6.0,description,5.5,what is the phone number for melia line ltd to inquire about their delivery services?,01227 751075
4733,1.0,description,2.2,what is the speed limit in this area?,30
4733,8.0,description,5.5,what company provides nationwide express delivery services?,melia line
4733,15.0,description,7.8,which photography-related establishment is it?,fotografiska
4734,7.0,description,5.5,which bank is about to open??,metro bank
4734,15.0,description,7.8,what information is provided on the sign with crossrail?,sites 099 101 102 103
4738,1.0,description,2.2,what are the restrictions indicated on the red route sign i passed?,no stopping mon-sat 7am-7pm
4738,5.0,description,3.8,what is the contact number for pinnacle psg?,033 0332 0845
4745,11.0,description,7.2,which building houses the 'feel-good show' advertisement?,on the back of a van
4746,3.0,description,3.8,which bus service runs on this route?,a7
4748,12.0,description,8.8,which vehicle in the scene belongs to the company shred-it?,the truck immediately in front of the car with the number plate sha 22p
4751,6.0,description,5.5,what does the extra politan sign on the bus indicate?,it's part of the bus tour service
4751,8.0,description,5.5,what is the website on the back of the white van?,www.edmundson-electrical.co.uk
4754,9.0,description,7.2,what different locations are mentioned on the back of the bus?,"golders green, king's cross, paddington, liverpool street, stratford, victoria"
4759,14.0,description,8.8,what the blue vehicle is advertising?,the vehicle is advertising a product priced at £1
4760,12.0,description,8.8,which car is directly in front of me based on its license plate?,bl60 obc
4769,2.0,description,2.2,what is the restriction or information indicated on the yellow road sign on the right?,"provides directions for specific buses including 15, 52, 521, 15h, n15, n199"
4769,5.0,description,3.8,which company does the van belong to?,amworld
4769,8.0,description,5.5,what's the name of the nearby photo service shop?,snappy snaps
4772,3.0,description,3.8,which company's van is parked in front of the building at 95 aldwych?,fcs group
4772,11.0,description,7.2,what advertisement is displayed on the back of the white vehicle in front of me?,the ultimate feel-good show
4772,13.0,description,8.8,"what is the contact number for lucketts, and should i consider reaching out to them for any enquiries?",01329 823755
5017,4.0,description,3.8,what are the services offered at unique grocery?,"money transfers, rta passes, cold beverages"
5019,3.0,description,3.8,what street am i currently on?,iberville street
5020,8.0,description,5.5,what is the rule at the street corner in front of the walgreens?,street name
5020,15.0,description,7.8,which street walgreens is located on?,iberville
5027,15.0,description,7.8,what is the exact name of the hotel i am looking for around here?,courtyard marriott
5030,2.0,description,2.2,what is the contact number to call for plumbing or hvac services?,610-916-1487
5030,7.0,description,5.5,what services does horizon services offer?,"heating, air conditioning, drain cleaning"
5030,15.0,description,7.8,what organization is currently hiring?,quest
5031,2.0,description,2.2,which organization's bus is passing by on my right side?,nj transit
5035,1.0,description,2.2,what is the speed limit on this road?,the speed limit is 35 mph
5042,10.0,description,7.2,what's the name of the road i am currently driving on?,corral canyon rd
5064,1.0,description,2.2,what company is this service van associated with?,tesla
5076,7.0,description,5.5,what is the phone number on the van in front of me?,877-412-8181
5078,2.0,description,2.2,what is the contact number for propark's services?,(646) 319-1356
5078,3.0,description,3.8,are there any restrictions for standing or parking on this street?,"yes, there is a sign that says no standing anytime"
5078,4.0,description,3.8,what is the name of the truck company parked on the left side of the street?,ferguson
5078,8.0,description,5.5,what kind of products does the ferguson truck advertise?,luxurious products
5078,12.0,description,8.8,what street am i on?,121 chamber st
5080,2.0,description,2.2,which business near this intersection has a sign that says now open?,starbucks
5082,9.0,description,7.2,which company that provides the laboratory service on the van?,a-l scientific
5082,14.0,description,8.8,what is displayed on the side of the large bus advertising an nyc experience?,the ride
5083,1.0,description,2.2,what is the contact number for dumbo moving + storage?,718-222-8282
5083,2.0,description,2.2,which building has a sign indicating it is now open?,the building under construction with the scaffolding on the left
5083,3.0,description,3.8,what is the contact number to call for interest in a driver position?,1-800-616-taxi
5094,1.0,description,2.2,what is the contact number for dumbo moving + storage to book a service?,718-222-8282
5094,11.0,description,7.2,which service types are offered by the moving company on the green truck?,"residential, commercial, long distance"
5094,15.0,description,7.8,which company's truck is currently blocking the lane?,dumbo moving + storage
5100,3.0,description,3.8,which company name is written on the left truck that appears?,borax
5101,9.0,description,7.2,what's the contact number for the van that provides air conditioning services?,516-799-2100
5101,12.0,description,8.8,what is the phone number for pronto pizza?,212-732-4131
5101,13.0,description,8.8,what are the parking restrictions on this street?,no standing anytime
5101,15.0,description,7.8,which vehicles are allowed to drive through this street on the left sign?,commercial vehicles only
5102,9.0,description,7.2,what is the contact number for leasing information at 19 dutch?,212-be-dutch
5116,8.0,description,5.5,which company offers security services as shown on the truck in front of me?,brinks
5143,1.0,description,2.2,what is the speed-limit?,25 mph
5147,4.0,description,3.8,which street am i currently driving on?,spalding dr
5147,9.0,description,4.8,what time are the no-stopping restrictions in effect here?,7 am to 7 pm
5147,11.0,description,7.2,what is the name of the tour company to look for if i want to follow the tour bus?,starline tours
5157,3.0,description,3.8,which banner indicates an upcoming event or exhibit that i might be interested in attending?,beyond streets
5157,12.0,description,8.8,what building number is next to the western jewelry mart?,608
5159,1.0,description,2.2,what is the phone number for adriana's insurance?,1800.639.0000
5159,3.0,description,3.8,what is the bus number?,910
5159,6.0,description,5.5,when is the release date for the teen titans go! to the movies as advertised on the building?,july 27
5159,13.0,description,8.8,what is the speed limit on this street?,the speed limit is 30
5161,3.0,description,3.8,could you tell me the contact number for the insurance advertisement on the bus?,1.800.639.0000
5161,4.0,description,3.8,what are the instructions provided for drivers in the lane ahead?,here wait
5166,1.0,description,2.2,what is the speed limit on this road?,30
5166,3.0,description,3.8,which restaurant is located on the left side of the street?,mr. masala
5168,7.0,description,5.5,what does the sign indicate about where i should stop for pedestrians to cross?,you should stop at the here mark on the road
5169,4.1,description,3.8,which restaurant is located on the right side of the street?,yang chow restaurant
5169,4.2,description,6.2,which restaurant is located on the right side of the street?,queen's bakery
5169,8.0,description,5.5,which center is located on the left side of the street?,dynasty centre
5172,13.0,description,8.8,which museum is being advertised in the banners along the street?,autry museum
5172,15.0,description,7.8,what company does the truck on the right belong to?,jfc international
5174,3.0,description,3.8,what brand shows in popular vehicles billboard?,toyota
5174,6.0,description,5.5,what brands or companies are promoted on the left red board?,toyota
5177,9.0,description,7.2,what landmark or notable place is prominently advertised in this area?,los angeles
5177,12.0,description,8.8,what is the price for items at the store on my right?,$3.99
5183,2.0,description,2.2,what's the hotel's name?,daimaru hotel
5183,8.0,description,5.5,which company is advertised on the truck to the left?,jfc international
5184,4.0,description,3.8,what is the maximum parking fee at this location?,$16.00 maximum
3,4.0,direction,4.5,which direction do i need to follow to reach barclays center?,head straight ahead
10,9.0,direction,8.5,which directions should i follow to get to parkside plaza’s parking area?,turn right
11,1.0,direction,2.7,where should trucks go according to the signs?,trucks should go straight
11,9.0,direction,8.5,which way should i go to enter the gas station?,turn right
12,14.0,direction,9.2,which street should i cross to get to dagwood & scoops?,the street in front of the building
19,3.0,direction,4.3,"if i want to go to cava, on which side of the street should i look for it?",the right side
26,2.0,direction,2.2,"if i want to continue on i-95 north towards new haven ct, how should i proceed?",stay in the current lane
26,3.0,direction,4.7,which exit should i take to webster avenue?,exit 2b
26,4.0,direction,4.7,which exit should i take to get off the freeway?,exit 2b
26,6.0,direction,6.5,where should i merge if i want to continue straight without exiting?,left lanes
26,9.0,direction,8.2,"if i want to take exit 2b, which lane should i take?",stay in the right lane
34,1.0,direction,2.2,which street do i need to turn onto to reach rufus king?,90 av
34,6.0,direction,5.5,what avenue am i currently driving on?,90 av
34,7.0,direction,5.5,where should i turn to follow the one-way street signs for 90 av?,turn right
41,1.0,direction,3.8,which direction should i be cautious of school children?,ahead
51,2.0,direction,2.7,which side of the street has the deli and grocery store?,the right side
51,3.0,direction,4.5,what should i do when i reach the intersections ahead?,stop at both stop signs
51,8.0,direction,6.5,what should i do when i reach the sign at the corner of the street?,come to a full stop
100,14.0,direction,10.5,which side should i head to find the united express terminal?,the right side
102,7.2,direction,1.5,how do i get to the gas station?,go straight and turn right
102,7.3,direction,7.8,how do i get to the gas station?,go back to the gastrac on the right
102,8.0,direction,5.5,which turn should i take to get to best buy from here?,a right turn
111,12.0,direction,8.8,which direction should i head to find the food truck serving the chicken?,turn left and head straight
116,1.0,direction,2.2,which side of the street is china king located on as i drive forward?,on the right side
116,5.1,direction,3.8,which direction should i go to the starbucks coffee shop?,to the left side of the street
116,5.2,direction,1.2,which direction should i go to the starbucks coffee shop?,there are no starbucks coffee shop here
122,2.0,direction,2.2,what direction does the one-way street go ?,it goes to the left
122,13.0,direction,8.8,which way should i go to follow the traffic direction on this road?,follow the direction indicated by the one way sign
126,1.0,direction,2.2,where should i turn to get onto i-678?,turn right
144,9.0,direction,7.2,which direction i should go to reach garden state community bank?,go right to reach garden state community bank
153,1.0,direction,2.2,"which direction should i take to get to new haven, ct?",follow the arrow sign pointing to the right
160,4.0,direction,3.8,what exit should i take to get to falls church?,exit 47 b-a
160,7.0,direction,5.5,which exit should i take to get to tyson's corner?,exit 47b-a
161,6.1,direction,5.5,what street intersection am i currently approaching?,e 64 st
161,6.2,direction,1.2,what street intersection am i currently approaching?,there are no street signs here
161,8.0,direction,5.5,where should i turn to east 64th street?,left
169,9.0,direction,7.2,which lane should i drive in to avoid traffic?,left lane
170,10.1,direction,7.2,which direction do i need to go to reach the bank?,turn left
170,10.2,direction,1.3,which direction do i need to go to reach the bank?,go straight and turn left
182,10.0,direction,7.2,where should i go if i want to find the detour for the midtown tunnel?,follow the orange sign with detour and an arrow pointing to the right
184,12.1,direction,8.8,what should i be aware of at this intersection in terms of traffic directions?,all traffic must turn right
184,12.2,direction,0.5,what should i be aware of at this intersection in terms of traffic directions?,stop here when red signal on
200,10.0,direction,7.2,where should i turn if i want to visit the metro store?,turn right when you see the metro sign
200,11.0,direction,7.2,which lane should i stay in to avoid traffic congestion?,stay in the middle lane
206,3.0,direction,3.8,in which direction is the turn restricted?,u-turn
206,8.0,direction,5.5,which university am i going to?,kingsborough community college
206,10.0,direction,7.2,which signal should i follow if i'm heading to kingsborough community college?,"the sign that says only, only"
206,11.0,direction,7.2,can i make a turn at this intersection?,yes
206,15.0,direction,7.8,can i turn right from this lane?,no
211,1.0,direction,2.2,which exit should i take to get to the queens zoo?,use exit 10
211,2.0,direction,2.2,which exit should i take to get to the hall of science?,use exit 10
211,3.0,direction,3.8,what highway should i follow if i need to go west?,to 495
223,1.0,direction,2.2,what street should i be on if i want to go to mount sinai hospital?,madison avenue
223,2.0,direction,2.2,where should i turn if i'm heading to madison avenue?,turn right
234,12.0,direction,8.8,which store is located along the way on the right side?,staple office
234,13.0,direction,8.8,which direction should i head in to find the famous deli from my current location?,turn right
243,3.0,direction,3.8,which city will i be heading towards?,new york
243,5.0,direction,3.8,which highway should i take to get to new haven?,i-95 north
243,8.0,direction,5.5,which direction should i take to new haven?,north
243,9.0,direction,7.2,in which direction is the conn tpke located?,north
243,10.0,direction,7.2,which lane should i be in to continue towards new haven?,stay in the left lane
243,11.0,direction,7.2,which direction should i take to new york?,right
247,2.0,direction,2.2,which direction should i go to barclays center?,right
247,3.0,direction,3.8,which way should i turn to get to metrotech center or fulton mall?,right
247,4.0,direction,3.8,which direction should i goto brooklyn bridge park?,left
247,6.0,direction,5.5,which direction should i go to the barclays center?,right
247,11.0,direction,7.2,which direction am i prohibited from turning at this intersection?,left turn
247,12.0,direction,8.8,can i drive in the straight direction?,"yes, if the light is green"
255,10.0,direction,7.2,which street should i be on to get to white castle?,43 st
259,4.0,direction,3.8,which way should i go to atlantic avenue?,head straight
259,5.0,direction,3.8,what are the restrictions on turning at this junction?,use the left turn bay only
259,9.0,direction,7.2,which direction is the one-way street leading from here?,straight ahead
259,10.0,direction,7.2,which street should i turn onto if i want to avoid making a left turn from the left turn bay?,atlantic av
271,7.0,direction,5.5,which exit should i take to get to kennedy airport?,take the exit for grand central pkwy east
277,1.0,direction,2.2,which exits should i take to get to yankee stadium?,exits 4-5
277,2.0,direction,2.2,where should i go if i need to get to grand concourse?,take the rightmost lane
277,3.0,direction,3.8,which way should i get off to go to 138 east road?,take the rightmost lane and choose the left at the next fork
277,11.0,direction,7.2,where will exit 3 lead me?,to e 138 st or grand concourse
277,15.0,direction,7.8,where does the road lead after taking exit 3?,to the right
301,3.0,direction,3.8,what direction should i drive to follow the one-way street signs?,forward or southward
301,4.0,direction,3.8,what direction should i go to continue on state street?,follow the one-way street sign
301,12.0,direction,8.8,which way shou ld i turn to reach nevins st?,straight
301,14.1,direction,8.8,is it safe to cross nevins street now?,yes
301,14.2,direction,1.1,is it safe to cross nevins street now?,no
310,3.0,direction,3.8,which lane should i stay in to follow the speed limit when approaching the exit?,the right-most lane
313,5.0,direction,3.8,which direction should i go to find the nyc airporter bus pickup?,make a right at the next exit
313,7.0,direction,5.5,which way should i go to get to the departing flights?,follow the sign pointing left for departing flights
313,13.0,direction,8.8,how do i get to terminals d from here?,turn right
317,1.0,direction,2.2,where is the nearest bath & body works store?,on the left side of the street
317,9.0,direction,7.2,what shops or landmarks can i use as a reference to get through this intersection?,bath & body works
317,10.0,direction,7.2,which lane should i use to continue driving straight?,any lane except the bus only lane
317,14.0,direction,8.8,where is the lane designated for buses only?,on the right side
317,15.0,direction,7.8,how should i navigate if i need to use the lane marked only?,it's specified only for bus and you can't
318,14.0,direction,8.8,which lane should i go in if i need to go straight?,the leftmost lane among the two visible lanes
319,3.0,direction,3.8,are right turns allowed at this intersection?,no
319,9.0,direction,7.2,where should buses and bikes travel to safely navigate this area?,on the designated lanes
319,10.0,direction,7.2,how do i ensure my truck is on the correct route?,follow best route for trucks southbound use 2 ave 10am-6pm mon-fri.
319,11.0,direction,7.2,which path is designated for bikes and pedestrians only?,follow outer rdwy bridge access bikes & peds only.
330,1.0,direction,2.2,how do i get to the nearest subway station?,it is just ahead towards the black sign labeled subway
330,4.0,direction,3.8,where is the entrance to the subway station located in relation to the boss hugo boss store?,it is directly in front of the boss hugo boss store
330,12.0,direction,8.8,which direction should i go to reach the jazz?,to the left
333,1.0,direction,2.2,what are the directions to get to rockaway blvd east from here?,follow the left three lanes
333,2.0,direction,2.2,which exit should i take to get to farmers blvd?,next right
334,6.0,direction,5.5,"which lane appears to be moving faster, the left or right lane?",left lane
334,13.0,direction,8.8,where do i turn to get to farmers blvd?,turn right
337,1.0,direction,2.2,how do i get to e 80 st if i need to get there?,go straight
337,10.0,direction,7.2,where is the lenscrafters store located in relation to the intersection?,near the intersection on the left side
343,7.0,direction,5.5,which direction am i supposed to go at the roundabout?,counterclockwise direction
343,9.0,direction,7.2,what do i do when i see a crosswalk?,slow down and yield to pedestrians
345,2.0,direction,2.2,where is the deli located in relation to my vehicle?,to the left
350,7.0,direction,5.5,how can i go across this junction?,trucks can go straight or turn left or right
358,12.0,direction,8.8,which lane should i take if i want to go straight ahead?,any lane can be used to go straight ahead
361,1.0,direction,2.2,which way should i go to get to duane reade?,take a left turn at the intersection
361,2.0,direction,2.2,which direction should i take to head towards bradhuurst avenue?,follow the street sign pointing to bradhuurst avenue
361,5.0,direction,3.8,how do i get to the intersection of bradhurst avenue and the one leading to duane reade?,"proceed straight on bradhurst avenue until you reach 145th street, then turn left to reach duane reade"
366,9.0,direction,7.2,which direction should i walk to enter sprouts farmers market from the parking lot?,walk straight towards the building from your parking spot
369,1.0,direction,2.2,which lane should i be in to take the exit for hudson pkwy?,be in the right lane
369,3.0,direction,3.8,where will this exit from the 9a n hudson parkway take me?,to the hudson pkwy
369,4.0,direction,3.8,what exit do i need to take to get to hudson parkway and w 181 st?,exit 1
369,6.0,direction,5.5,which direction from here to the n hudson parkway?,straight ahead
369,7.0,direction,5.5,which lane do i need to be in to take exit 1 to 9a?,the right lane
369,11.0,direction,7.2,which street will i reach if i take this exit?,w 181 st
370,1.0,direction,2.2,which exit should i take to reach manhattan?,take the exit for harlem riv dr or fdr dr which also indicates manhattan
370,3.0,direction,3.8,what are the directions for getting to the major deegan expressway?,take the exit marked maj deegan expwy on the rightmost lane
370,4.0,direction,3.8,which exit should i take if i want to go to harlem river drive?,exit 2
370,6.0,direction,5.5,where do i need to go if i want to take the major deegan expressway?,exit 3
370,8.0,direction,5.5,what are the two options for getting on i-95 north from here?,"follow the i-95 north signs, either from the left or right lanes"
370,11.0,direction,7.2,where should i go if i want to continue on i-95 north?,straight ahead
370,12.0,direction,8.8,what is the name of the expressway?,maj deegan expwy
370,14.0,direction,8.8,"if i want to go to the major deegan expressway, which lane should i stay in?",right lane
370,15.0,direction,7.8,where should i turn to head towards manhattan on fdr drive?,go straight
384,2.0,direction,2.2,where should i position my car?,the right lane
