video_id,question_id,question_type,timestamp (s),question,correct_answer
450,2.0,location,2.2,which building is villa aroma located in?,the corner building on the right
450,5.0,location,3.8,which street am i currently driving on?,geary
474,1.0,location,2.2,where can i find parking nearby?,park n lock
474,9.0,location,7.2,which place offers dining services and is welcoming customers on the left?,welcome to cafe 31
475,3.0,location,4.0,what are some clothing store options i can see from here?,levi's and gap
475,4.0,location,4.0,what shops are on the left side of the street that i can visit?,levi's
475,6.0,location,5.5,which building is directly across from herald towers?,levi's
475,8.0,location,5.5,where can i find a zara store on this street?,on the left side
475,10.0,location,7.2,which store should i go to buy some new outdoor gear?,american eagle outfitters
475,14.1,location,8.8,where can i buy shoes?,geox
475,14.2,location,3.5,where can i buy shoes?,forever 21
477,5.0,location,3.8,where do vehicles over 7'-0 need to go?,enter terminal b
477,15.1,location,7.8,where do i go if i want to find the wait area?,keep right
477,15.2,location,3.4,where do i go if i want to find the wait area?,there are no signs here
479,1.0,location,2.2,where is best buy store?,on the right side of the road
479,4.0,location,3.8,where can i purchase electronics?,best buy
479,10.0,location,7.2,what time does the q66 bus arrive at the best buy location?,we cannot derive time information
479,12.1,location,8.8,is there a gas station nearby?,"yes,gastrac"
479,12.2,location,1.2,is there a gas station nearby?,"no,there is no gas station here"
479,15.0,location,7.8,what landmarks are nearby?,the home depot
480,1.0,location,2.2,where is the nearest best buy located from my current position?,on the right side of the street
480,3.0,location,3.8,what store is near the large orange building ahead on the left?,home depot
480,4.0,location,3.8,where is best buy store?,straight ahead on the left side of the road
480,9.0,location,7.2,where should i park near home depot?,stop at the parking lot next to the home depot sign
480,12.1,location,8.8,what street am i on?,50th street
480,12.2,location,2.5,what street am i on?,there are no signs here
502,2.0,location,2.2,where is times square bwl ?,to the right of the counter
502,10.0,location,7.2,where is the “10 times square” building located in relation to w 41 st?,on the right side of w 41 st
503,3.0,location,3.8,where could i possibly stop for fuel?,plattekill service area
503,8.0,location,5.5,where might this truck lead me to shop?,it might lead to a walmart store
509,8.1,location,5.5,where is the closest hardware store located?,el barrio hardware on the left side
509,8.2,location,1.1,where is the closest hardware store located?,there are no hardware store here
509,11.0,location,7.2,which street are we currently driving on?,e 103 st
516,1.0,location,2.2,what is the nearby shop i should visit if i need to buy skincare products?,aveda
516,11.0,location,7.2,what stores or establishments can i visit nearby?,aveda
1000,5.0,location,3.8,which building should i look for to buy tile products for home renovation?,home tile center
1000,10.0,location,7.2,which store can i expect to find luxury bathroom products?,the store with the toto sign
2007,11.0,location,8.5,where is the tata building located in this scene?,on the right side
2007,13.1,location,10.5,where is the nearest bus stop?,near the billboard on the right side of the road
2007,13.2,location,2.3,where is the nearest bus stop?,there are no bus stops here
2008,9.0,location,8.5,where is the bus stop nearby?,near the billboard on the right side of the road
2008,10.0,location,8.5,what is on sale at mdbf pop?,burgers
2012,3.0,location,4.2,where can i find the motorcycle with the license plate mp-04 nx 4986?,to the right near the tree line
2012,11.0,location,8.5,where can i find the scooter with the license plate ts 07 fs9576?,"on the right side of the road, next to the curb"
2019,5.0,location,4.5,where is the siddarth neuro center located?,on the right side of the street
2019,15.0,location,9.5,are there any advertisements on this road?,"yes,on the right side of the road"
2020,9.0,location,8.5,where is the vehicle with the license plate ap 28 de 2030 relative to my position?,to my right
2021,4.0,location,4.3,where can i find a car with the license plate ap28 dp 2895 parked on this street?,on the right side of the street
2021,13.1,location,10.5,where is the nearest sbi shop?,it is directly across the street on the right
2021,13.2,location,1.5,where is the nearest sbi shop?,there are no sbi shops here
2022,1.0,location,2.5,where is the nearest sbi shop?,near the trees on the right side of the road
2022,6.0,location,6.5,which bank has a branch located near the street i am on?,sbi
2023,2.0,location,2.5,where is the gachibowli traffic police station located?,near maxcure hospital
2023,7.0,location,6.5,where do i report a traffic accident here?,gachibowli traffic police station
2033,5.1,location,4.5,where should i go if i need dental services?,vijaya dental hospital
2033,5.2,location,2.2,where should i go if i need dental services?,there are no dental hospitals around here
2040,3.0,location,4.5,where can i find more information about the local courier service?,www.brings.app
2040,5.0,location,4.5,how can i contact the delivery service?,visit www.brings.app
2041,11.0,location,8.5,which city does the local courier service operate in?,hyderabad
2100,6.0,location,5.5,where can i find the speed limit sign to ensure i'm driving within legal limits?,on a pole beside the road
2100,14.0,location,8.8,which landmarks should i look for to locate sri manikanta?,near the store with the large wines sign
2100,15.0,location,7.8,what stores or points of interest are available on this street for quick stops?,wine shop near sri mahalaxmi
2103,2.0,location,2.2,where is nagarjuna park colony located?,"it is straight ahead, past the archway"
2103,4.1,location,3.8,where can i find something to eat?,look for the sign that says this way to deliciousness with food images
2103,4.2,location,6.2,where can i find something to eat?,should turn back and found that says this way to deliciousness with food images
2103,6.0,location,5.5,which baker is nearby?,gilbert baker
2103,8.0,location,5.5,what is the school near the diamond oak building?,rao's my techno school
2103,12.0,location,8.8,where can i find child-centered education in this area?,rao's my techno school
2127,5.0,location,3.8,where can i find the 'dr. sridhar' in this area?,the building in the center at the end of the street
2128,1.0,location,2.2,which building is dr. sridhar international dental hospital located in?,in the center
2128,3.1,location,3.8,how can i find  glitterz?,"it's on the third floor of the building, with an glitterz sign"
2128,3.2,location,0.8,how can i find  glitterz?,not found
2128,6.0,location,5.5,where is the nearest hospital?,dr. sridhar international dental hospital
2128,8.0,location,5.5,which clinic or hospital near me might deal with skin issues?,skinstd clinic
2129,3.0,location,3.8,where should i go for dental care?,dr. sridhar international dental hospital
2129,5.0,location,3.8,which pharmacy can i find around here to buy some medicine?,apollo pharmacy
2130,1.0,location,2.2,which hospital can i visit for dental issues?,dr. sridhar international dental hospital
2130,2.0,location,2.2,where can i buy pharmaceutical products around here?,apollo pharmacy
2246,1.0,location,2.2,where can i find the srilalitha store in this area?,the srilalitha store is on the right side of the road
2246,11.0,location,7.2,what hospitals are there around here?,shree hospital
2246,13.1,location,8.8,where can i find footwear?,mathaji footwear
2246,13.2,location,3.5,where can i find footwear?,not found
2247,1.0,location,2.2,where can i find a place to buy shoes nearby?,at mathati foot wear
2247,2.0,location,2.2,which building should i head to medical assistance?,at shree hospital
2247,5.1,location,3.8,which building do i need to enter to get to shree hospital?,the building with the shree hospital sign
2247,5.2,location,2.1,which building do i need to enter to get to shree hospital?,not found
2250,1.0,location,2.3,where can i find the airtel store for mobile services?,in the shops on the left side of the street
2250,5.2,location,0.7,where can i find bank ?,not found
2250,5.3,location,7.3,where can i find bank ?,should turn back and found the icici bank sign
2250,10.0,location,7.2,where can i find the restaurant & bar?,it is on the left side of the street
2307,2.0,location,2.3,where is the reminder about drinking and driving located?,on the back of the u turn sign
2307,7.0,location,5.5,where can i find the salon as indicated in the road signs?,sooper salon
2317,5.1,location,3.8,where is the new landmark that is being advertised located?,hyderabad
2317,5.2,location,0.4,where is the new landmark that is being advertised located?,not found
2317,13.0,location,8.8,where should i go to catch a bus on this road?,to the bus bay
2354,3.0,location,3.8,where is the homeo clinic?,the building with multiple antennas on the roof
2354,11.0,location,7.2,which store should i visit to buy donuts?,sanjos donuts
2354,15.1,location,7.8,which clinic offers homeopathic services here?,home clinic
2354,15.2,location,1.7,which clinic offers homeopathic services here?,not found
2361,4.2,location,0.3,where can i find sohail mobiles?,not found
2361,4.3,location,9.2,where can i find sohail mobiles?,"after turning right, the building on your left is"
2361,9.0,location,7.2,which building houses the gym?,on the left
2361,13.1,location,8.8,where can i find a place to have a cup of tea around here?,go to manu tea
2361,13.2,location,4.5,where can i find a place to have a cup of tea around here?,not found
2362,6.0,location,5.5,which shop might sell a new mobile phone?,sohail mobiles
2362,7.0,location,5.5,where can i go to buy a sim card?,sohal mobiles
2366,5.2,location,0.3,where can i find fresh chicken ?,not found
2366,5.3,location,7.4,where can i find fresh chicken ?,should turn back and found the sneha fresh chicken sign
2366,8.0,location,5.5,where can a child attend ppre-primary program?,little ville
2366,10.0,location,7.2,where should i go to enroll my child in 'little ville' school?,near the signboard on the left side indicating 'little ville.'
2373,2.0,location,2.2,where is the angaara2 restaurant located on this street?,on the left side
2374,10.0,location,7.2,where is the jaguar - motors located?,to the left of the traffic
2375,9.0,location,7.2,where can i get a taxi?,"in front of you, with registration ts07ua9722"
2376,2.0,location,2.2,where can i find the jaguar motors dealership around here?,the jaguar motors dealership can be found on the building to the left
2377,4.0,location,3.8,which building is the jaguar dealership in?,the building with jaguar motors sign on the left
2377,12.0,location,8.8,are there any other motor cab vehicles nearby?,"yes, there are one"
2378,2.0,location,2.2,is there a specific brand or showroom visible along this street that i might want to visit?,"yes, you might want to visit the jaguar showroom"
2378,14.0,location,8.8,where is the motor cab with the license plate ts07ua9722 going?,traveling along a busy street
2379,1.0,location,2.2,where is the closest jaguar dealership from this traffic stop?,on the left side of the traffic stop
2385,9.0,location,7.2,"are there any vehicles near me that are not from the state with the code ap? if so, which ones?","yes, there two cars with the license plate starting with ts"
2385,15.0,location,7.8,where is the motorbike with the license plate ap 28 dq 5364 located in relation to the car with the license plate ts07es4323?,on the right rear side of the car
2396,1.1,location,2.2,which shop should i look for to buy sweets?,the shop named mithai bhandar on the left
2396,1.2,location,7.3,which shop should i look for to buy sweets?,"a store named mithai bhandar have already passed by, you can turn around and find it"
2396,6.0,location,5.5,where can i find a store labeled computers on this street?,on the right side of the street
2396,11.0,location,7.2,where can i find the glamsudios building on this street?,on the left side
2397,1.0,location,2.2,where is the nearest airtel store and how can i get there from my current location?,"the nearest airtel store is on the left side of the street, among the buildings"
2397,4.0,location,3.8,where can i find dental services nearby?,partha dental
2398,2.0,location,2.2,which dental clinic can i find?,partha dental
2405,5.0,location,3.8,which business can be found next to ganesh on this street?,laxmi plywood
2405,8.0,location,5.5,where can i find the sahara opticals shop mentioned?,on the right side of the street
2405,13.0,location,8.8,which shop am i near that likely sells medical supplies?,med plus
2409,5.0,location,3.8,which shop offers both sofas and fabrics?,sofas fabrics
2421,2.0,location,2.2,where can i find more information about the project?,contact numbers on signs
2421,14.0,location,8.8,where can i find information about the training and test center?,about the gyanvriksh billboard on the left
2429,4.0,location,3.8,what is the tower in front of me?,signature towers
2430,1.0,location,2.2,where is the building named signature towers located on?,it is on the left side of the street
2431,5.0,location,3.8,where is the malabar establishment located in?,on the left side of the traffic signal
2432,4.0,location,3.8,which branch of malabar gold & diamonds am i near?,kondapur
2432,14.0,location,8.8,what is the nearest bridgestone shop?,on the same side as the oyo building
2433,2.0,location,2.2,where can i find the service or advertisement related to act?,on a signpost to the right side of the street
2433,4.0,location,3.8,where can i find the nearest oyo hotel?,it is in one of the buildings on the left side of the street
2434,2.0,location,2.2,where can i find an oyo facility around here?,on the left side of the street
2435,3.0,location,3.8,where can i see the logo of oyo in the surrounding buildings?,the logo of oyo is visible on the top of the building labeled ektha towers.
2435,7.0,location,5.5,which building is associated with oyo and ektha towers?,the building on the left side of the road
2438,4.0,location,3.8,where is the car wash service located?,it is on the left side of the road
2439,2.0,location,2.2,where can i find car wash services?,at washway.
2439,6.1,location,5.5,where can i find car care services?,mobil 1 car care on your left
2439,6.2,location,8.2,where can i find car care services?,mobil 1 car care which pasted，you should turn back
2440,6.0,location,5.5,where am i supposed to move my boardroom?,to your living room
2440,14.0,location,8.8,"where can i find ambicare clinics or services, and what landmarks are there to ensure i am in the right place?","it is located on the ground floor of a building visible behind the traffic, near a shop with a yellow and black umbrella"
2442,1.0,location,2.2,what type of store is on my left along this road?,comfort store
2442,4.1,location,3.8,what is the place where i can find a food court?,pan factory
2442,4.2,location,0.7,what is the place where i can find a food court?,not found
2442,9.0,location,7.2,where is the car with the license plate starting with ts in front of me?,on the left
2442,10.0,location,7.2,where can i find information about the speed limit on this road?,on the sign that says 30
2442,14.0,location,8.8,which car accessories store is on the left?,sturnez wheels
2446,7.0,location,5.5,where is the closest place to find luxury rooms?,deli tinn luxury rooms
2447,1.0,location,2.2,which building is the santosh family dhaba located in?,a building with a yellow sign
2447,4.2,location,0.1,where can i find a place to get color prints and net ?,not found
2447,4.3,location,9.2,where can i find a place to get color prints and net ?,"next to ad-big colour xerox net printswhich passed by,we should turn around"
2447,5.0,location,3.8,which restaurant should i go to eat family dhaba?,santosh family dhaba
2447,7.0,location,5.5,where is a place that offers xerox and lamination services?,srinivasa
2447,15.0,location,7.8,where is dr. venus' clinic?,on the right side of the road
2448,2.0,location,2.2,where can i go to visit dr. venus for a consultation?,the clinic on the right side of the road
2448,14.0,location,8.8,which store is across the street?,titan
2450,11.1,location,7.2,where can i  get a hotel room?,oyo
2450,11.2,location,1.5,where can i  get a hotel room?,not found
2451,7.0,location,5.5,where is the duroflex store located in relation to my current position?,on the left side of the road
2451,15.0,location,7.8,where can i get skincare treatment services nearby?,dr. venus
2452,1.0,location,2.2,where is the nearest hospital located from my current position?,krajitha hospitals
2452,2.0,location,2.2,where is information about the services offered by dr. venus available?,billboard beside the road
2452,11.0,location,7.2,which clinic has the emergency services ?,dr. venus
2453,7.0,location,5.5,where is the cloud fitness building located in this street?,above multiple shops on the left side of the street
2453,14.1,location,8.8,where could i find a place to eat?,gokul tiffins
2453,14.2,location,2.3,where could i find a place to eat?,not found
2454,1.0,location,2.2,which building has the fitness center in it?,the building with the sign cloud fitness
2455,3.0,location,3.8,where can i buy coffee around?,café coffee day
2455,4.0,location,3.8,which building has a gym named cloud fitness?,the building on the left side
2455,8.0,location,5.5,which fitness center is on this street?,cloud fitness
2456,4.0,location,3.8,which restaurant is next to the nice sign?,arabian shawarma
2456,5.0,location,3.8,where is hardware and plywood store?,next to the nice sign
2457,4.0,location,3.8,where can i get some tea and snacks?,mandi king tea & snacks
2457,5.0,location,3.8,which restaurant serves arabian cuisine?,mandi king arabian restaurant
2458,1.0,location,2.2,which restaurant serves arabian food?,mandi king
2458,10.0,location,7.2,which shop should i visit to buy some palm sugar?,masala palm shop
2458,12.0,location,8.8,where is the billboard advertising ford located?,on the left side of the road
2458,13.0,location,8.8,where can i find a good place to buy toys ?,reference billboard with the just for u sign
2459,2.0,location,2.2,where is the advertisement for ford available?,on a billboard above the traffic
2459,12.0,location,8.8,where is the building named metro located relative to my position?,"on the left side, behind the printo sign"
2462,3.0,location,3.8,where is the aig sign?,"on the left side of the road, near the trees"
2462,9.1,location,7.2,where can i find a restaurant?,consider visiting spice kitchen
2462,9.2,location,1.2,where can i find a restaurant?,not found
2464,9.0,location,7.2,where is the nearest 'trip' booking office or service advertisement?,on the building
2464,11.0,location,7.2,where is the building with the cyient sign?,near the arch on the left side of the road
2465,8.0,location,5.5,where is the phone number for contacting?,on a billboard
2465,10.0,location,7.2,where is the nearest outlet for universal?,on the left side of the road
2466,2.0,location,2.2,where should i go to purchase furniture?,go to the store with the universal furnitures sign
2466,4.0,location,3.8,where is the ply hardware store among the buildings?,next to frozen bottle on the left side
2466,5.1,location,3.8,which shop can have ice cream treat serve?,frozen bottle
2466,5.2,location,0.4,which shop can have ice cream treat serve?,not found
2466,10.0,location,7.2,where is the advertisement displayed with the phone number 9885119144?,on the large billboard structure
2468,1.0,location,2.2,what is the building “engreen”located?,marvel
2468,3.0,location,3.8,which shop is opposite “casa” on the road?,twins
2468,6.0,location,5.5,where is the san oto family dhaba building?,right next to the building with the casa sign
2468,8.0,location,5.5,which store sells art furniture?,antique art furniture
2468,9.0,location,7.2,where is a shop called data science authority?,on the left side
2468,12.0,location,8.8,which building should i go to look for a showroom of elica?,the building on the left side
2470,3.1,location,3.8,what is the international school?,glendale international school
2470,3.2,location,1.1,what is the international school?,not found
2470,9.0,location,7.2,where should i go to learn more about the programs offered by glendale international school?,the red billboard on the left
2474,3.0,location,3.8,which shop sells organic food nearby?,the shop on the left
2474,4.0,location,3.8,where is a store that sells a variety of goods as described?,china bazar
2474,14.0,location,8.8,where is a shop to buy a bike?,bike
2475,1.0,location,2.2,where is the china bazar?,the store on the left side
2475,13.0,location,8.8,which type of store is adjacent to the china bazar?,food and grocery store
2476,1.0,location,2.2,which store can i buy toys and accessories?,china bazar
2476,2.0,location,2.2,where is a place celebrating its 7 years?,a store with a sign that says celebrating our 7 years
2476,8.0,location,5.5,where is the 'waseem bikes' shop?,on the right side of the street 
2476,10.0,location,7.2,where is the china bazar located?,next to the food grooming toys & accessories sign
2477,3.0,location,3.8,where is store with the word waseem on this road?,on the right side of the road
2481,5.0,location,3.8,where is the advertisement?,on the billboard
2481,11.0,location,7.2,where is the sticker that says kun united located?,on the hyundai car
2481,13.0,location,8.8,where is the license plate“ts07uc7784” of the hyundai car?,on the rear of the car
2483,14.0,location,8.8,where is the phone number of auto-rickshaw?,on the right side of the hyundai car
2484,4.0,location,3.8,which store can i visit for fabrication services?,shoukat fabrication
2484,10.0,location,7.2,do any of shops sell beds or mattresses along this road?,comfort beds & mattresses
2485,1.0,location,2.2,where is the nearest bar?,suraj bar
2485,7.0,location,5.5,which establishment offers homeopathic treatments?,sri aurobindo homeo
2485,10.0,location,7.2,what services are the sri kanaka durga establishment?,gas welding works
2485,11.0,location,7.2,which place should i go to get some photocopying done?,k.g.n. xerox
2485,12.1,location,8.8,where can i find the flex?,near k.g.n. xerox
2485,12.2,location,1.2,where can i find the flex?,not found
2490,1.0,location,2.2,where is the vennelalo gisticis?,on the right side of the street with the white and yellow bus
2490,9.0,location,7.2,where is the advertisement for arshi?,on a signboard on the right side of the street
2491,7.1,location,5.5,where can i find a place serving chicken?,hi-fi hotle
2491,7.2,location,0.1,where can i find a place serving chicken?,not found
2491,9.1,location,7.2,what are some nearby businesses or hotels?,majestic
2491,9.2,location,8.8,what are some nearby businesses or hotels?,majestic and hi-fi hotle
2491,14.0,location,8.8,where is information about the clothing store named majestic available?,on the left
2492,1.0,location,2.2,which shop should i head to get chicken biryani?,"on the left side of the road, under the hotel sign"
2492,3.0,location,3.8,where is the majestic sign?,above hotel，on the left side of the road
2492,6.0,location,5.5,where should i go to visit the arshi medical facility or shop at the cera style gallery?,to the buildings on the right side of the road
2492,8.0,location,5.5,which place is advertising chicken biryani for 80/-?,"on the left side of the road, under the hotel sign"
2492,9.0,location,7.2,is parking allowed here?,no
2492,11.0,location,7.2,what food options are available at the restaurant near the majestic sign?,chicken and mutton
2493,3.0,location,3.8,where is the cera style gallery?,on the right side
2493,15.1,location,7.8,where can i find the 'shiva sai' store or establishment ?,on the left side of the road
2493,15.2,location,1.2,where can i find the 'shiva sai' store or establishment ?,not found
2494,7.0,location,5.5,where is the shiva sai store located in?,"to the left, on the roadside"
2496,4.0,location,3.8,what is the general store i can visit?,shiva sai
2496,9.0,location,7.2,where is more information about the hyundai dealership available?,visit the website www.talwarhyundai.com
2497,2.0,location,2.2,where is the shiva sai general store located in?,on the left side of the traffic
2497,4.0,location,3.8,which store should i go to if i need general supplies?,go to shiva sai
2497,10.0,location,7.2,where is the nearest store i can pick up general supplies from?,shiva sai
2497,14.0,location,8.8,which vehicle has the license plate ts 08 fu 4237 and where is it relative to my vehicle?,a motorcycle to the left of my vehicle
2498,1.0,location,3.8,what store should i look for if i need general supplies?,shiva sai
2499,2.0,location,2.2,where can i buy general store supplies?,shiva sai 
2499,4.0,location,3.8,where is the entrance to the shiva sai stores?,near the storefront sign “shiva sai”
2499,13.0,location,3.8,where is the nearest general store and what is its name?,shiva sai stores on the left side  
2502,4.0,location,3.8,which shop is on my left side?,shivya sai
2502,8.0,location,5.5,where is more information about the hyundai dealership available?,www.talwarhyundai.com
2503,2.0,location,2.2,"where is a medical store for any immediate needs, and what is its name?",shiva sai
2503,11.0,location,7.2,where is the shiva sai store located along this street?,on the left
2504,1.0,location,2.2,which general store should i visit for purchasing?,shiva sai  
2504,7.0,location,5.5,where is the shiva sai stores located on this road?,on the left side of the road
2504,10.0,location,3.8,which store  might sell everyday items?,shiva sai
